<?xml version="1.0" encoding="UTF-8"?>
<xs:schema xmlns:xs="http://www.w3.org/2001/XMLSchema" elementFormDefault="qualified">
  <xs:element name="biblioteka">
    <xs:complexType>
      <xs:sequence>
        <xs:element ref="dzial" maxOccurs="unbounded"/>
      </xs:sequence>
    </xs:complexType>
  </xs:element>
  <xs:element name="dzial">
    <xs:complexType>
      <xs:sequence>
        <xs:element name="nazwadzialu" type="xs:string"/>
        <xs:element ref="ksiazka" minOccurs="1" maxOccurs="unbounded"/>
      </xs:sequence>
    </xs:complexType>
  </xs:element>
  <xs:element name="ksiazka">
    <xs:complexType>
      <xs:sequence>
        <xs:element ref="autor" type="xs:string" minOccurs="1" maxOccurs="2"/>
        <xs:element name="tytul" type="xs:string" minOccurs="1" maxOccurs="1"/>
        <xs:element name="cena">
       		<xs:simpleType>
			<xs:restriction base="xs:integer">
			 <xs:minInclusive value="10"/>
			 <xs:maxInclusive value="200"/>
			</xs:restriction>
		</xs:simpleType>
	</xs:element>
      </xs:sequence>
    </xs:complexType>
  </xs:element>
  <xs:element name="autor">
    <xs:complexType>
      <xs:sequence>
        <xs:element name="imie" type="xs:string" minOccurs="1" maxOccurs="1"/>
        <xs:element name="nazwisko" type="xs:string" minOccurs="1" maxOccurs="1"/>
      </xs:sequence>
    </xs:complexType>
  </xs:element>
</xs:schema>